{
  "$id": "https://ouroboros.local/schemas/agent-trust-request-v1.schema.json",
  "$schema": "https://json-schema.org/draft/2020-12/schema",
  "additionalProperties": true,
  "description": "Input JSON accepted by the local no-network/no-wallet/no-execution Agent Trust Bundle CLI and HTTP surfaces.",
  "properties": {
    "contract_version": {
      "const": "agent-trust-bundle-v1",
      "type": "string"
    },
    "intended_integration_context": {
      "description": "Buyer/consumer supplied description of where Agent Trust would sit in the agent loop before a risky tool, API, or payment-like action.",
      "type": "string"
    },
    "ledger": {
      "description": "Optional local mock ledger rows used only for deterministic policy quote accounting.",
      "items": {
        "additionalProperties": true,
        "type": "object"
      },
      "type": "array"
    },
    "policy": {
      "additionalProperties": true,
      "description": "Flexible x402 policy object. Common fields include agent_id, allowed_resources, per_request_cap, per_agent_budget_cap, and settlement.",
      "type": "object"
    },
    "provenance_evidence": {
      "description": "Optional discovery/identity provenance evidence, including DNS-AID/ANS-style claims. Evidence only; not authorization or trust by itself.",
      "oneOf": [
        {
          "type": "object"
        },
        {
          "type": "array"
        },
        {
          "type": "string"
        }
      ]
    },
    "resource": {
      "type": "string"
    },
    "tool_descriptor": {
      "description": "Optional tool/MCP descriptor or list/string descriptor inspected without network calls or execution.",
      "type": [
        "object",
        "array",
        "string"
      ]
    }
  },
  "required": [
    "policy"
  ],
  "title": "Agent Trust Bundle request v1",
  "type": "object"
}
